{
  "summary": "Adding a two-tier persistent research cache feature that touches 14+ files across 5 modules: new Pydantic models in models.py (consumed by 33+ callers of OrchestratorConfig), new research_cache.py module mirroring test_runner.py, engine integration in engine.py and workflow_engine.py (_mcp_servers property change affects all agent invocations), prompt injection in phases.py (affects 3 phase prompt builders), config loading via default.yaml, a new Node.js MCP server, and 4 agent definition file updates. The change is architecturally additive (new optional fields with safe defaults, graceful degradation) but the blast radius spans the entire agent invocation path. The pre-existing WorkflowEngine._mcp_servers asymmetry (knowledge-only, missing test_runner) compounds the risk — fixing it as part of this feature changes MCP tool availability for all workflow-mode agents.",
  "overall_risk": "medium",
  "change_surface": [
    {
      "module": "src/orchestrator/models.py",
      "change_type": "additive",
      "description": "Add 5 new Pydantic BaseModel classes (ResearchCacheConfig, ResearchCacheContext, ResearchEntry, Finding, ResearchCache) and 2 new fields to OrchestratorConfig (research_cache, research_cache_context). All have safe defaults — OrchestratorConfig() with no args continues to work. Models.py has 153 exports and is imported by virtually every module in the codebase."
    },
    {
      "module": "config/default.yaml",
      "change_type": "additive",
      "description": "Add research_cache YAML section with 11 keys after the test_runner block. Additive-only — no existing keys are modified. Affects config loading path: load_config() → OrchestratorConfig validation."
    },
    {
      "module": "src/orchestrator/research_cache.py",
      "change_type": "additive",
      "description": "New file — implements MCP integration functions (get_research_mcp_config, ensure_research_mcp_config, cleanup_research_mcp_config), cache operations (load_cache, lookup, save_entry, extract_research_from_artifact), and findings accumulator (flag_finding, format_recommendations). Mirrors test_runner.py pattern exactly. No existing files modified — pure addition."
    },
    {
      "module": "../sdlc-mcp-servers/research-cache/",
      "change_type": "additive",
      "description": "New Node.js MCP server directory — package.json, index.js, README.md. Exposes 4 tools: lookup_research, save_research, flag_finding, get_run_recommendations. External to main codebase. Writes to ~/.orchestrator/research/ (global) and .knowledge/research/ (project) directories."
    },
    {
      "module": "src/orchestrator/engine.py",
      "change_type": "behavioral_change",
      "description": "Add research cache lifecycle to OrchestratorEngine: (1) new self._research_mcp_config instance var in __init__, (2) initialization after test_runner setup in run(), (3) merge into _mcp_servers property, (4) post-phase artifact extraction when auto_extract=True, (5) end-of-run recommendations output, (6) cleanup in finally block. engine.py's run() method (275 lines) gains ~30 lines of research cache integration code. The _mcp_servers property change affects ALL agent invocations in both legacy and workflow mode."
    },
    {
      "module": "src/orchestrator/workflow_engine.py",
      "change_type": "behavioral_change",
      "description": "Expand _mcp_servers property (line 635) to merge research-cache config AND fix pre-existing asymmetry by also merging test_runner config. This is both a new feature integration and a bug fix — workflow-mode agents will now have access to test_runner AND research-cache MCP tools that they previously lacked. Also adds post-phase extraction in task completion path and cleanup in teardown."
    },
    {
      "module": "src/orchestrator/main.py",
      "change_type": "additive",
      "description": "Add recommendations printing after _print_summary when research_cache_context.findings is non-empty. Guarded by null check — no behavioral change when feature is disabled."
    },
    {
      "module": "src/orchestrator/phases.py",
      "change_type": "behavioral_change",
      "description": "Add _inject_research_context() function and update _inject_mcp_role_guidance() to include research-cache tools (lookup_research, save_research, flag_finding) in MCP tool table. Affects prompt content for 3 roles: pm, architect, principal_engineer. Prompt content changes for all runs where research cache is enabled (default: true)."
    },
    {
      "module": ".claude/agents/deep_researcher.md",
      "change_type": "additive",
      "description": "Add Research Cache usage section instructing agent to call lookup_research before researching, save_research after fresh research, flag_finding for actionable issues."
    },
    {
      "module": ".claude/agents/market_researcher.md",
      "change_type": "additive",
      "description": "Add Research Cache usage section with project-tier guidance for market/competitor data."
    },
    {
      "module": ".claude/agents/competitor_researcher.md",
      "change_type": "additive",
      "description": "Add Research Cache usage section with project-tier guidance."
    },
    {
      "module": ".claude/agents/architect.md",
      "change_type": "additive",
      "description": "Add Research Cache usage section with global-tier guidance for tech decisions and architecture patterns."
    }
  ],
  "downstream_impacts": [
    {
      "id": "IMPACT-001",
      "affected_module": "All agent invocations (via _mcp_servers property)",
      "risk_level": "high",
      "impact_type": "behavioral_change",
      "description": "The _mcp_servers property in both engine.py and workflow_engine.py is read by EVERY agent invocation to determine available MCP tools. Adding 'research-cache' to this dict means all agents (not just the 3 targeted roles) will have access to lookup_research, save_research, flag_finding, and get_run_recommendations tools. While only pm/architect/principal_engineer receive prompt injection encouraging cache use, any agent could discover and call these tools. The WorkflowEngine fix also adds test_runner tools to workflow-mode agents for the first time.",
      "requires_update": false,
      "migration_steps": [
        "Verify _mcp_servers merge uses null-guard pattern: only merge when config.research_cache_context and config.research_cache_context.mcp_server_config is not None",
        "Verify workflow-mode test suite passes with new test_runner merge (pre-existing gap being fixed)",
        "Verify agent invocations handle gracefully when MCP server binary is absent (tools not available)"
      ]
    },
    {
      "id": "IMPACT-002",
      "affected_module": "tests/test_models.py — OrchestratorConfig tests",
      "risk_level": "medium",
      "impact_type": "behavioral_change",
      "description": "OrchestratorConfig gains two new fields (research_cache: ResearchCacheConfig, research_cache_context: ResearchCacheContext | None). Any test that instantiates OrchestratorConfig() and asserts on its field list, serialized output, or model_dump() keys will see new fields. Tests that use _make_config() pattern are safe since they pass explicit kwargs. Tests that assert config.model_dump() == expected_dict will fail unless updated. The existing TestOrchestratorConfigDefaults already has test_research_cache_config_defaults and test_research_cache_context_is_none_by_default tests present, suggesting models.py has already been partially updated.",
      "requires_update": true,
      "migration_steps": [
        "Verify existing OrchestratorConfig tests pass with new default fields (additive change should be safe)",
        "Update any tests that assert exact field sets or model_dump() equality to include new fields",
        "Confirm _make_config() pattern works without needing research_cache kwarg"
      ]
    },
    {
      "id": "IMPACT-003",
      "affected_module": "src/orchestrator/config.py (load_config function)",
      "risk_level": "medium",
      "impact_type": "behavioral_change",
      "description": "load_config() reads YAML and constructs OrchestratorConfig. Adding research_cache section to default.yaml means load_config now parses 11 additional keys. If the YAML section has type mismatches (e.g., string instead of int for base_ttl_days), Pydantic validation will raise ConfigurationError. The load_config function is called by 31+ callers including main.py, dashboard/runner.py, mobile_api/app.py, and 20+ test fixtures.",
      "requires_update": false,
      "migration_steps": [
        "Verify default.yaml values exactly match ResearchCacheConfig field defaults and types",
        "Run existing config loading tests to confirm no regressions",
        "Verify load_config handles missing research_cache section gracefully (uses Pydantic defaults)"
      ]
    },
    {
      "id": "IMPACT-004",
      "affected_module": "tests/test_config.py — config loading tests",
      "risk_level": "low",
      "impact_type": "behavioral_change",
      "description": "TestLoadConfig* test classes use load_config() with YAML fixtures. If any test provides a YAML string that is parsed by the updated config model, the new research_cache defaults will be present in the resulting config object. Tests that assert specific field values (not exhaustive equality) are safe. 30+ test methods in this file.",
      "requires_update": false,
      "migration_steps": [
        "Run tests/test_config.py and verify all pass without modification",
        "If any test uses exact dict comparison on config output, add research_cache to expected output"
      ]
    },
    {
      "id": "IMPACT-005",
      "affected_module": "tests/test_engine.py — engine initialization tests",
      "risk_level": "medium",
      "impact_type": "behavioral_change",